{"authority":"CANONICAL_RECORD","concurrency":{"declared_source_fingerprint":"sha256:645ae41a91ea956786428d242b2e4616a16092931fbbeaddc6139795098072d6","expected_main_sha":"4e297f7cb1206f16230d282c9da9ecbb986c1a8a","expected_parent_feather":"FTR-NSTEALUEMBITCO27XTBC2542XN","expected_quest_revision":2},"current_position":"AJ-01 through AJ-12 are PROVEN; CAP-027 is RESTORED and ACTIVE; all 28 capability dispositions are reconciled; generated-current state is accepted through PR #220; the final whole-Quest Strikeforce is GREEN; and Phoenix recovery is PROVEN and ACCEPTED. The restart-safe Sunset is sealed while RP-C08 and Repairing Prime remain IN_PROGRESS only for final completion.","durable_source_references":[{"authority":"CANONICAL_SOURCE","digest":"sha256:c2b21ec91a467cf1ef326089269ccfc809d9c5da7aa023e787590748541f6e34","ref_id":"repairing-prime-source","uri":"quests/repairing-prime.md"},{"authority":"CANONICAL_SOURCE","digest":"sha256:8cdc470ddb98b62bd3648d69441b6f8bf0ce000c79ea4e52ff0220ab2ddae737","ref_id":"lifecycle-contract","uri":"lifecycle/lifecycle-contract.md"},{"authority":"CANONICAL_SOURCE","digest":"sha256:341c90fe6dabaa064f540bacc0943f7be56190f141bf62de5c575540c0a3f5c9","ref_id":"capability-acceptance-contract","uri":"governance/capability-acceptance-contract.md"},{"authority":"CANONICAL_SOURCE","digest":"sha256:646b76a12628e135b327cf020e70347bdf005f94feb503f4bdfa58315946af5c","ref_id":"prime-continuity-register","uri":"continuity/prime-continuity-register-r01.json"}],"latest_feather_id":"FTR-I4Y4BS3VPYM3J7NEFXGBR4767F","next_gate":"FINAL_REPAIRING_PRIME_COMPLETION_TRANSACTION","operation_ids":["operation-source-governance"],"prior_emberline_id":"QEM-R6QKBDHLY7I7PVVEKIGTZFMZZT","project_id":"project-codex","protected_data":{"classification":"INTERNAL_CLEAN","clean_summary":"The final Repairing Prime Sunset contains only public-clean Atlas source references, sanitized evidence pointers, and no protected values.","protected_pointers":[]},"quest_id":"repairing-prime","quest_revision":2,"record_id":"QEM-R5DK5RHF6IYPT3LFUKZN27NWTU","schema_id":"atlas.lifecycle.quest-emberline","schema_version":"1.0.0","unresolved_blockers":["The final Repairing Prime completion transaction remains separately gated."]}
